{
  "$schema": "./schemas/qiw-config-schema.json",
  "version": "1.0.0",
  "repository": "APGI-cmy/PartPulse",
  "qiw_enabled": true,
  "last_updated": "2026-01-14T07:58:00.000Z",
  
  "channels": {
    "build": {
      "enabled": true,
      "description": "Monitors code compilation, dependency resolution, and build process health",
      "triggers": [
        "on_commit",
        "on_pr",
        "on_deployment_preparation"
      ],
      "detectors": [
        {
          "name": "build_failure_detector",
          "type": "threshold",
          "enabled": true,
          "threshold": {
            "metric": "build_failure_rate",
            "operator": "greater_than",
            "value": 0.05,
            "window": "7d",
            "severity": "high"
          }
        },
        {
          "name": "build_duration_anomaly",
          "type": "threshold",
          "enabled": true,
          "threshold": {
            "metric": "build_duration_increase",
            "operator": "greater_than",
            "value": 0.50,
            "baseline": "30d_average",
            "severity": "medium"
          }
        },
        {
          "name": "dependency_conflict_detector",
          "type": "pattern",
          "enabled": true,
          "pattern": "dependency.*conflict|ERESOLVE|peer dependency",
          "severity": "high"
        },
        {
          "name": "flaky_build_detector",
          "type": "pattern",
          "enabled": true,
          "description": "Detects intermittent build failures on same code",
          "severity": "medium"
        }
      ],
      "metrics": [
        "build_success_rate",
        "build_duration",
        "dependency_resolution_failures",
        "configuration_errors",
        "build_artifact_integrity"
      ],
      "blocking_rules": {
        "critical": {
          "block_merge": true,
          "block_deployment": true,
          "require_immediate_fix": true
        },
        "high": {
          "block_merge_to_main": true,
          "block_deployment": true,
          "require_remediation_plan": true
        },
        "medium": {
          "block_merge": false,
          "create_tracking_issue": true,
          "require_remediation_within": "7d"
        },
        "low": {
          "block_merge": false,
          "log_only": true
        }
      }
    },
    
    "lint": {
      "enabled": true,
      "description": "Monitors code style, static analysis, and linting violations",
      "triggers": [
        "pre_commit",
        "on_pr"
      ],
      "detectors": [
        {
          "name": "lint_violation_increase",
          "type": "threshold",
          "enabled": true,
          "threshold": {
            "metric": "lint_violation_count",
            "operator": "increases_without_plan",
            "severity": "medium"
          }
        },
        {
          "name": "critical_violation_in_main",
          "type": "pattern",
          "enabled": true,
          "pattern": "error|critical",
          "branch": "main",
          "severity": "critical"
        },
        {
          "name": "lint_bypass_detector",
          "type": "pattern",
          "enabled": true,
          "pattern": "eslint-disable|@ts-ignore|@ts-nocheck",
          "severity": "medium"
        },
        {
          "name": "code_complexity_threshold",
          "type": "threshold",
          "enabled": true,
          "threshold": {
            "metric": "cyclomatic_complexity",
            "operator": "greater_than",
            "value": 15,
            "severity": "high"
          }
        }
      ],
      "metrics": [
        "lint_violation_count",
        "violation_severity_distribution",
        "code_complexity_metrics",
        "style_consistency_score",
        "technical_debt_indicators"
      ],
      "blocking_rules": {
        "critical": {
          "block_merge": true,
          "require_immediate_fix": true
        },
        "high": {
          "block_merge_to_main": true,
          "require_remediation_plan": true
        },
        "medium": {
          "block_merge": false,
          "create_warning": true
        },
        "low": {
          "block_merge": false,
          "log_only": true
        }
      }
    },
    
    "test": {
      "enabled": true,
      "description": "Monitors test execution, coverage, reliability, and test health",
      "triggers": [
        "on_commit",
        "on_pr",
        "scheduled_regression"
      ],
      "detectors": [
        {
          "name": "test_pass_rate_drop",
          "type": "threshold",
          "enabled": true,
          "threshold": {
            "metric": "test_pass_rate",
            "operator": "less_than",
            "value": 0.95,
            "severity": "critical"
          }
        },
        {
          "name": "coverage_decrease",
          "type": "threshold",
          "enabled": true,
          "threshold": {
            "metric": "coverage_percentage",
            "operator": "decreases_without_approval",
            "severity": "high"
          }
        },
        {
          "name": "flaky_test_detector",
          "type": "threshold",
          "enabled": true,
          "threshold": {
            "metric": "test_flakiness_rate",
            "operator": "greater_than",
            "value": 0.02,
            "description": "More than 2% failure rate on stable code",
            "severity": "high"
          }
        },
        {
          "name": "test_dodging_detector",
          "type": "pattern",
          "enabled": true,
          "description": "Code changes without corresponding test updates",
          "severity": "high"
        },
        {
          "name": "skipped_test_detector",
          "type": "pattern",
          "enabled": true,
          "pattern": ".skip|.todo|xit\\(|xdescribe\\(",
          "severity": "medium"
        },
        {
          "name": "test_duration_degradation",
          "type": "threshold",
          "enabled": true,
          "threshold": {
            "metric": "test_execution_time",
            "operator": "increases_by",
            "value": 0.25,
            "baseline": "30d_average",
            "severity": "medium"
          }
        }
      ],
      "metrics": [
        "test_pass_rate",
        "test_coverage_percentage",
        "test_execution_time",
        "flaky_test_count",
        "test_dodging_incidents",
        "test_debt_count"
      ],
      "test_dodging_config": {
        "enabled": true,
        "exclusions": [
          "*.md",
          "*.json",
          "*.yaml",
          "*.yml"
        ],
        "test_file_patterns": [
          "__tests__/**/*.test.ts",
          "__tests__/**/*.test.tsx",
          "*.test.ts",
          "*.test.tsx",
          "*.spec.ts",
          "*.spec.tsx"
        ]
      },
      "blocking_rules": {
        "critical": {
          "block_merge": true,
          "block_deployment": true,
          "require_immediate_fix": true
        },
        "high": {
          "block_merge_to_main": true,
          "require_remediation_before_release": true
        },
        "medium": {
          "block_merge": false,
          "create_tracking_issue": true
        },
        "low": {
          "block_merge": false,
          "log_only": true
        }
      }
    },
    
    "deployment": {
      "enabled": true,
      "description": "Monitors deployment process, environment health, and deployment success",
      "triggers": [
        "on_deployment",
        "environment_health_check"
      ],
      "detectors": [
        {
          "name": "deployment_failure_rate",
          "type": "threshold",
          "enabled": true,
          "threshold": {
            "metric": "deployment_failure_rate",
            "operator": "greater_than",
            "value": 0.10,
            "window": "7d",
            "severity": "high"
          }
        },
        {
          "name": "repeated_rollback_detector",
          "type": "pattern",
          "enabled": true,
          "description": "Multiple rollbacks to same version",
          "severity": "critical"
        },
        {
          "name": "environment_drift_detector",
          "type": "pattern",
          "enabled": true,
          "description": "Configuration differences between environments",
          "severity": "high"
        },
        {
          "name": "deployment_duration_anomaly",
          "type": "threshold",
          "enabled": true,
          "threshold": {
            "metric": "deployment_duration",
            "operator": "increases_significantly",
            "baseline": "30d_average",
            "severity": "medium"
          }
        },
        {
          "name": "post_deployment_health_check_failure",
          "type": "pattern",
          "enabled": true,
          "pattern": "health.*check.*failed|readiness.*probe.*failed",
          "severity": "critical"
        }
      ],
      "metrics": [
        "deployment_success_rate",
        "deployment_duration",
        "rollback_frequency",
        "environment_drift_count",
        "configuration_validation_failures",
        "post_deployment_health_score"
      ],
      "blocking_rules": {
        "critical": {
          "block_deployment": true,
          "trigger_rollback": true,
          "escalate_immediately": true
        },
        "high": {
          "block_production_deployment": true,
          "allow_staging_with_warning": true,
          "require_remediation_plan": true
        },
        "medium": {
          "allow_deployment": true,
          "create_tracking_issue": true,
          "monitor_closely": true
        },
        "low": {
          "allow_deployment": true,
          "log_only": true
        }
      }
    },
    
    "runtime": {
      "enabled": true,
      "description": "Monitors application behavior in production/staging, errors, and performance",
      "triggers": [
        "continuous_monitoring"
      ],